{
  "schema": 1,
  "name": "http_client",
  "version": "0.4.0",
  "deps": [{ "name": "crypto", "range": ">=1.0" }],
  "native": [
    {
      "id": "curl_shim",
      "soname": "libcurl_shim.1.dylib",
      "kind": "shared",
      "mode": "link",
      "file": "../libcurl_shim.1.dylib",
      "needs": ["libcrypto_native.1.dylib"]
    }
  ]
}
